movie,year,rating,genre,runtime_min,imdb,metascore,votes,director(s),stars,review,recommendations
Oppenheimer: The Real Story,2023,,['Documentary'],96.0,7.1,,90,Robin Bextor,,"[""Oppenheimer: The Real Story is a captivating and thought-provoking documentary that delves into the life and legacy of J. Robert Oppenheimer, the brilliant physicist behind the development of the atomic bomb. Directed by David Clyde, this film offers a comprehensive look at Oppenheimer's personal journey, his scientific achievements, and the ethical dilemmas he faced during World War II.\n\nOne of the film's greatest strengths is its ability to provide a balanced portrayal of Oppenheimer. Through insightful interviews with historians, experts, and Oppenheimer's own words, Clyde showcases his multifaceted persona. From his early days as a restless intellectual to his role as the scientific leader of the Manhattan Project, the film explores Oppenheimer's complex motivations and his inner struggles with the consequences of his creation.\n\nThe pacing and narrative structure of the documentary are incredibly engaging, effortlessly weaving together archival footage, photographs, and interviews. The film also benefits from its attention to detail, presenting the scientific advancements in a way that is accessible to both experts and laypeople alike.\n\nOppenheimer: The Real Story doesn't shy away from the ethical questions surrounding Oppenheimer's work either. It unflinchingly examines the long-lasting impact of the atomic bomb and the devastating consequences of its use in Hiroshima and Nagasaki. This exploration of morality adds a profound layer of introspection to the film, prompting viewers to reflect on the responsibility of scientific progress.\n\nOverall, Oppenheimer: The Real Story is a compelling documentary that sheds light on the life and legacy of one of history's most influential scientists. It is a must-watch for those interested in understanding the complexity of Oppenheimer's character and the moral dilemmas inherent in scientific advancement.""]","['Trinity and Beyond The Atomic Bomb Movie', 'Fat Man and Little Boy', 'The Day After']"
Grey Gardens,1975,PG,"['Documentary', 'Comedy', 'Drama']",95.0,7.6,82.0,14726,"['Ellen Hovde', 'Albert Maysles', 'David Maysles', 'Muffie Meyer']","['Edith Bouvier Beale', ""Edith 'Little Edie' Bouvier Beale"", 'Brooks Hyers']","['Movie Review: Grey Gardens (1975)\n\nGrey Gardens, directed by Albert and David Maysles, is a mesmerizing documentary that offers an intimate glimpse into the eccentric lives of Edith Bouvier Beale and her daughter, ""Little"" Edie Beale. Dubbed ""the scandalous society has-beens,"" this documentary delves deep into their secluded world, revealing layers of both tragedy and unmistakable charm.\n\nAt its core, Grey Gardens is a study of the complexity of family relationships and the consequences of living in self-imposed isolation. Edith and Edie, two members of the upper crust of society turned reclusive hoarders, slowly reveal their contrasting personalities as the camera captures their daily rituals. The film creatively oscillates between past and present, giving viewers a taste of the duo\'s glamorous past contrasted sharply with their current chaotic existence.\n\nOne of the documentary\'s greatest strengths is its ability to capture the unique personalities of both mother and daughter. Edith\'s naïveté and childlike innocence make for poignant moments, while Edie\'s sharp wit and desire for fame add a layer of bitter irony. As the filmmakers peel back the layers of their lives, we get wrapped up in the two women\'s oddities and their eccentric charm.\n\nThe Maysles brothers\' fly-on-the-wall approach brilliantly captures the subtle nuances of Grey Gardens. The unscripted dialogue and unadorned camera work allow us to immerse ourselves fully in the Beales\' world, without judgment or interference. The result is an intimate and captivating experience that blurs the line between voyeurism and empathy.\n\nGrey Gardens is an unconventional gem that challenges traditional documentary filmmaking. It\'s a poignant exploration of familial bonds, mental health, and the human experience, wrapped up in an intriguing package. Whether you\'re familiar with the Beales\' story or encountering it for the first time, this documentary will undoubtedly leave an indelible mark and open your eyes to a world few have ever seen.']","['Paris is Burning', 'The Queen', 'Crumb']"
Mr. Jimmy,2019,,['Documentary'],113.0,7.6,,22,Peter Michael Dowd,"['Akio Sakurai', 'Rie Nakahara', 'Toshio Suzuki', 'Kiyomi Osawa']","[""Mr. Jimmy is a heartfelt and inspiring film that explores the power of music and the resilience of the human spirit. Directed by Tom Stevens, this documentary takes us on a journey into the life and struggles of Jimmy Jenkins, a 70-year-old street performer in New Orleans.\n\nThe film beautifully captures the rich musical culture of the city, as Jimmy uses his saxophone to fill the streets with soulful melodies every day. His passion for music and his love for New Orleans are evident in every note he plays, and the film does an excellent job of showcasing the raw emotion and joy that his music brings to those who listen.\n\nBut Mr. Jimmy is not just about the music. It delves deep into Jimmy's personal life, shedding light on the challenges he has faced throughout his journey, including homelessness and health issues. The documentary strikes a perfect balance between showcasing his struggles and celebrating his resilience. It reminds us of the strength that music can provide during the toughest times in life.\n\nStevens' direction is masterful, allowing the story to unfold organically and capturing intimate moments that truly tug at the heartstrings. The cinematography beautifully captures the essence of New Orleans, immersing the audience in its vibrant culture.\n\nOverall, Mr. Jimmy is a moving and inspiring documentary that will leave viewers with a renewed appreciation for the power of music and the indomitable spirit of individuals like Jimmy Jenkins. It is a must-watch for anyone seeking a heartfelt and uplifting cinematic experience.""]","['Searching for Sugar Man', 'Amy', 'Feet from Stardom']"
Grizzly Man,2005,R,"['Documentary', 'Biography']",103.0,7.8,87.0,59722,Werner Herzog,"['Timothy Treadwell', 'Amie Huguenard', 'Werner Herzog', 'Carol Dexter']","[""Grizzly Man is a captivating and deeply unsettling documentary that delves into the life of Timothy Treadwell, a self-appointed bear enthusiast who lived among the majestic creatures in the Alaskan wilderness. Directed by Werner Herzog, this film is an unforgettable exploration of obsession, nature's untamed beauty, and the blurred line between humans and wildlife.\n\nWhat sets Grizzly Man apart is its raw and unfiltered approach. Through Treadwell's own recordings and interviews with his family and friends, we glimpse his intense passion for bears, but also his increasing detachment from reality. Treadwell's conviction that he could coexist harmoniously with these powerful creatures makes for both intriguing and frightening viewing. Herzog skillfully combines Treadwell's footage with stunning visuals of the Alaskan landscape, highlighting the stark contrasts between the serene beauty of nature and the harsh realities of survival.\n\nAt its core, Grizzly Man poses uncomfortable questions about our place in the natural world. Treadwell's story serves as a cautionary tale, reflecting the consequences of unchecked obsession and the dangers of underestimating nature's primal instincts. The film's intense and haunting moments, particularly the sequences involving Treadwell's final days, evoke a mixture of curiosity, disbelief, and genuine horror.\n\nWhile Grizzly Man may not offer quick resolutions or easy answers, it serves as a thought-provoking and cautionary reminder of humanity's precarious relationship with the untamed. Herzog's masterful storytelling and Treadwell's fascinating yet tragic journey make this documentary a must-watch for those interested in the complexities of our natural world and the unsettling truths that lie within.""]","['Man on Wire', 'March of the Penguins', 'The Thin Blue Line']"
Stephen Curry: Underrated,2023,PG-13,"['Documentary', 'Sport']",110.0,7.3,69.0,2964,Peter Nicks,"['Stephen Curry', 'Bob McKillop', 'Jason Richards', 'Reggie Miller']","['In ""Stephen Curry: Underrated,"" director Alex Simpson takes audiences on an exhilarating journey that sheds light on the incredible talent and untold story of one of the NBA\'s most beloved players. Simpson skillfully captures the essence of Stephen Curry, a man who has defied expectations and proved his doubters wrong throughout his career.\n\nThe documentary is a perfect mix of captivating interviews, game footage, and personal anecdotes. Simpson expertly weaves together Curry\'s rise to stardom, showcasing his struggles and perseverance, both on and off the court. This compelling narrative is sure to resonate with basketball enthusiasts and casual fans alike.\n\nWhat makes ""Stephen Curry: Underrated"" stand out is its ability to showcase Curry\'s impact on the game. Through heartfelt testimonials from teammates, coaches, and rivals, we gain a deeper understanding of the profound influence Curry has had on the sport. His unmatched shooting skills and revolutionary style of play have forever changed the way basketball is played.\n\nVisually stunning, the documentary captures the sheer brilliance of Curry\'s performances, highlighting his awe-inspiring long-range shots and seemingly impossible ball handling. The film\'s sleek editing and dynamic soundtrack complement the on-court action, immersing viewers in the electrifying atmosphere of NBA arenas.\n\nWhile some may argue that Curry is already highly acclaimed, ""Stephen Curry: Underrated"" artfully conveys the constant challenges he faced as a player and how he continually proved his critics wrong. It emphasizes the importance of perseverance, hard work, and self-belief, making it a powerful and inspiring film for audiences of all ages.\n\nOverall, ""Stephen Curry: Underrated"" is a must-watch for any basketball fan. It unveils a different side of Curry, showing us why he is not just a player but an icon who has made an indelible mark on the sport. Simpson\'s masterful storytelling allows us to truly appreciate Curry\'s greatness, leaving us inspired and in awe of his undeniable talent.']","['Hoop Dreams', 'Coach Carter', 'Love  Basketball']"
They Shall Not Grow Old,2018,R,"['Documentary', 'History', 'War']",99.0,8.2,91.0,37075,Peter Jackson,"['Thomas Adlam', 'William Argent', 'John Ashby', 'Attwood']","[""Movie Review: They Shall Not Grow Old\n\nPeter Jackson’s documentary, They Shall Not Grow Old, is a powerful tribute to the soldiers who fought in World War I. Using groundbreaking technology, Jackson breathes life into archival footage and brings viewers closer to the realities of war in a way never seen before.\n\nThe film begins in black and white, gradually transitioning into vibrant color. This transformative effect is both mesmerizing and haunting, as it reveals the true essence of the soldiers and their experiences. The attention to detail is impeccable, from the meticulously restored visuals to the addition of sound effects and dialogue, bringing authenticity to every frame.\n\nBut it's not just the technical prowess that makes this documentary exceptional; it is the human story it tells. Through interviews with veterans, their voices give depth to the footage, recounting their fears, camaraderie, and the horrors they witnessed. These testimonials create a deeply emotional connection with the audience, reminding us of the sacrifices made by these ordinary men.\n\nJackson's direction highlights the contrast between the camaraderie and the brutality of the war. From joyous moments in the trenches to the devastating aftermath of battles, he captures the paradoxical nature of warfare vividly. The film's pace is carefully balanced, allowing for introspection and reflection while still maintaining the viewer's engagement.\n\nThey Shall Not Grow Old is an astounding achievement that alters our perception of the past. It is a lovingly crafted tribute to those who fought and represents a testament to the resilience of the human spirit. Through its artistry and storytelling, it immerses us in the world of World War I like never before. This documentary is a must-see for anyone interested in history or simply seeking a transformative cinematic experience.""]","['Dunkirk', 'The Bridge on the River Kwai', 'Hacksaw Ridge']"
Skin: A History of Nudity in the Movies,2020,,"['Documentary', 'History']",130.0,6.7,64.0,1071,Danny Wolf,"['Warren Beatty', 'Martine Beswick', 'Linda Blair', 'Peter Bogdanovich']","['Skin: A History of Nudity in the Movies"" is a thought-provoking and informative documentary that delves into the controversial subject of nudity in cinema. Directed by Danny Wolf, this film takes its viewers on a fascinating journey through the evolution and impact that on-screen nudity has had throughout the history of film.\n\nThrough a mix of interviews, archival footage, and film clips, Wolf provides a comprehensive look at how nudity has been depicted and perceived in various eras of cinema. From the silent era to the present day, the documentary explores the cultural, social, and artistic factors that have influenced the portrayal of nudity on screen.\n\nOne of the documentary\'s strengths is its balanced approach to the subject matter. While it sheds light on the objectification and exploitation that has often been associated with nudity in film, it also highlights the artistic and political motivations behind its inclusion. This nuanced perspective adds depth and credibility to the film\'s exploration of the topic.\n\nMoreover, ""Skin"" is successful in its ability to engage the audience with its wealth of interviews. Notable industry figures, such as actors, directors, and critics, provide valuable insights and personal anecdotes that enrich the narrative. Their perspectives offer a comprehensive understanding of the challenges and breakthroughs that have shaped the depiction of nudity in film.\n\nUltimately, ""Skin: A History of Nudity in the Movies"" is an eye-opening and thought-provoking documentary. It explores a subject often overlooked or dismissed, shedding light on the complex intersection of art, culture, and society. Whether you are a film enthusiast or simply curious about the topic, this documentary is a captivating exploration of a subject that continues to ignite debate.']","['Electric Boogaloo The Wild Untold Story of Cannon Films', 'This Film Is Not Yet Rated', 'The Celluloid Closet']"
Wham!,2023,TV-14,"['Documentary', 'Biography', 'Music']",92.0,7.5,73.0,6756,Chris Smith,"['Bananarama', 'Bono', 'David Bowie', 'Boy George']","[""Title: Wham! - An Electric Journey Through Music and Friendship\n\nRating: ★★★★☆\n\nWham! directed by Joe Musiclover is a joyous, heartfelt and irresistibly entertaining celebration of the iconic 80s pop duo. This documentary offers an electrifying journey that not only delves into their musical successes but also explores the complex dynamics of friendship.\n\nWham! encapsulates the youthful exuberance and boundless energy that made George Michael and Andrew Ridgeley a cultural phenomenon. Through a seamless blend of archival footage, interviews, and concert performances, the film reveals the duo's meteoric rise to fame, from their humble beginnings to becoming international superstars.\n\nDirector Joe Musiclover crafts a captivating narrative that highlights not only their chart-topping hits but also the personal struggles, creative process, and the impact their music had on global audiences. The film effortlessly captures the essence of the 80s era, transporting viewers back in time with its vibrant visuals and infectious music.\n\nWhat truly elevates Wham! is its exploration of the bond between George Michael and Andrew Ridgeley. The documentary delves into their genuine friendship, showcasing the ups and downs they experienced throughout their journey. Their charismatic chemistry shines through every frame, and the audience can't help but be moved by their unwavering camaraderie.\n\nWhile Wham! primarily caters to fans of the band and lovers of 80s pop, it also serves as an enlightening piece of music history for younger generations. The film reminds us of the impact Wham! had on pop culture and why their music endures to this day.\n\nWham! is a spirited and uplifting tribute to the enduring legacy of George Michael and Andrew Ridgeley. It will make you laugh, dance, and reminisce, leaving you with a newfound appreciation for one of the most iconic duos in pop music history.""]","['Ferris Buellers Day Off', 'Dirty Dancing', 'Back to the Future']"
Trap Jazz,2023,TV-MA,"['Documentary', 'Music']",94.0,6.8,,32,Sadé Clacken Joseph,"['Chris Moten', 'Stixx Taylor', 'Cassius Jay', 'Gabriel Turner']","[""Title: Trap Jazz: A Unique Fusion that Hits All the Right Notes\n\nRating: ★★★★☆ (4/5)\n\nIn the realm of catchy and experimental music genres, Trap Jazz emerges as a breathtaking combination that challenges traditional boundaries. Directed by visionary filmmaker, Trap Jazz captivates audiences with its intoxicating fusion of two seemingly contrasting genres - trap music and jazz.\n\nFrom the onset, Trap Jazz immerses viewers in a world of sonic innovation, showcasing the raw energy and urban vibe synonymous with trap music, flawlessly intertwined with the smooth elegance and improvisational nature of jazz. Through a gripping narrative that traverses the contrasting lives of two talented musicians, the film successfully parallels their personal struggles with the harmonious blend of genres.\n\nOne of the film's standout strengths lies in its stellar performances. The cast delivers powerful portrayals, immersing audiences in the trials and tribulations faced by musicians caught between embracing their true artistic identities and conforming to societal expectations. Each actor brilliantly conveys their character's emotional journey, bringing depth and authenticity to the story.\n\nDirecting-wise, Trap Jazz excels in seamlessly blending the visual aesthetics of two distinct worlds. The cinematography expertly showcases the contrasting atmospheres of gritty urban settings and intimate jazz clubs, serving as a visual representation of the central conflict. The director amplifies the emotional impact through well-crafted montages that brilliantly synchronize the music with the characters' internal struggles.\n\nHowever, Trap Jazz occasionally struggles with pacing issues, resulting in a few lulls in the narrative. While these instances may disrupt the overall flow, they do not detract substantially from the film's captivating concept and thematic depth.\n\nIn conclusion, Trap Jazz is a trailblazing and boundary-pushing film that introduces audiences to an utterly unique musical combination. This genre-bending sensation seamlessly blends trap music and jazz, sparking a truly innovative experience. Despite minor pacing flaws, Trap Jazz emerges as a must-watch for those seeking fresh and daring cinematic endeavors.""]","['Whiplash', 'La La Land', 'Birdman']"
The Lost Century: And How to Reclaim It,2023,,['Documentary'],,7.9,,412,Michael Mazzola,"['Fred Durst', 'Steven M. Greer']","['Title: The Lost Century: And How to Reclaim It - A Thought-Provoking Journey\n\nRating: ★★★★☆ (4/5)\n\n""The Lost Century: And How to Reclaim It"" is a poignant and thought-provoking documentary that challenges our perception of time and its influence on our lives. Directed by an up-and-coming filmmaker, this non-fiction piece offers a unique exploration of a seemingly intangible concept: a lost century.\n\nThe film takes the audience on a captivating journey through the elusive concept of the lost century. Through a combination of interviews, expert commentaries, and stunning visuals, it presents a compelling case for why humanity has lost an entire century to sociopolitical and technological distractions. The film successfully captures the viewers\' attention, urging them to reflect on their own role in wasting precious time.\n\nThe narrative structure is artfully crafted, weaving together personal stories of individuals affected by this lost century alongside historical events and technological advancements that propelled society forward. The cinematography showcases breathtaking scenery, enhancing the film\'s immersive experience.\n\nWhat sets ""The Lost Century"" apart is its ability to strike an emotional chord. The interviews with people who have experienced personal losses while feeling trapped in the fast-paced modern world evoke empathy and self-reflection. The filmmaker masterfully portrays the struggles faced by individuals longing to reclaim their own sense of time and purpose.\n\nWhile the documentary delves deep into its subject matter, it occasionally loses focus, leaving audiences yearning for more exploration of certain ideas. Pacing issues arise, particularly in the middle, where the repetitive nature of the narrative could have been streamlined.\n\nNevertheless, ""The Lost Century: And How to Reclaim It"" is a powerful reminder to value and reclaim our time. It challenges viewers to question the choices they make in an increasingly frenetic society. Thought-provoking and visually captivating, this documentary is a valuable contribution to the genre, pushing boundaries and stirring conversation long after the credits roll.']","['Inception', 'Interstellar', 'The Matrix']"
Unknown: Cave of Bones,2023,TV-PG,['Documentary'],93.0,6.7,,1581,Mark Mannucci,"['Keneiloe Molopyane', 'Lee Berger', 'Agusin Fuentes', 'John Hawks']","[""Unknown: Cave of Bones dives deep into the genre of horror, promising an intense and spine-chilling experience. Directed by John Smith, this film takes viewers on a terrifying journey as a group of explorers venture into an uncharted cave system.\n\nThe atmosphere created in Unknown: Cave of Bones is nothing short of haunting. The eerie darkness and claustrophobic cave setting intensify the sense of dread. The tension steadily builds as supernatural elements come into play, keeping viewers on the edge of their seats. The expertly crafted cinematography adds to the movie's eerie charm, making the audience feel as if they are right there in the underground labyrinth.\n\nNot only does this film deliver on scares, but it also introduces intriguing characters. The dynamics between the explorers are explored, allowing the viewers to form connections with them, adding an emotional depth to the story. The performances from the cast are commendable, especially Emily Johnson, who delivers a strong and convincing performance as the determined lead.\n\nWhile Unknown: Cave of Bones does rely on some familiar horror tropes, it successfully offers a fresh take on the genre. The use of practical effects and minimal CGI adds a sense of realism, effectively immersing the audience in the terror-filled world. The mystery surrounding the cave's history and the supernatural forces at play are captivating, leaving viewers guessing and questioning until the very end.\n\nOverall, Unknown: Cave of Bones is a must-watch for horror enthusiasts craving a bone-chilling experience. With its atmospheric setting, compelling characters, and cleverly executed scares, it stands out in the crowded genre, making it a memorable and enjoyable watch.""]","['Unbreakable', 'The Bourne Identity', 'Inception']"
Black Hawk Down,1997,Not Rated,['Documentary'],57.0,7.9,,28638,Chris Mills,"['Mike Goodale', 'Shawn Nelson', 'Dale Sizemore']","[""Black Hawk Down is an intense and gripping war film that captivates from start to finish. Directed by Ridley Scott, it is based on the true story of a disastrous military mission by the U.S. Army Rangers and Delta Force in Somalia in 1993.\n\nThe film plunges viewers into the heart of the chaos, skillfully recreating the relentless gunfire and explosive action of the battle. The cinematography is stunning, with Scott expertly capturing the chaos and confusion of the battlefield. The sound design adds another layer of realism, immersing the audience in the terrifying violence of war.\n\nThe ensemble cast excels in their roles, including Josh Hartnett, Ewan McGregor, and Tom Sizemore, who deliver powerful performances. Each character is well-developed, allowing us to understand their motivations and fears. The emotional weight of the film is heightened by the fact that these events actually happened, and the sacrifices made by the soldiers are vividly portrayed.\n\nBlack Hawk Down goes beyond being a mere war film; it explores the themes of courage, brotherhood, and the cost of war. It raises questions about the morality of military intervention and reminds us of the inherent dangers faced by those who serve. The disciplined storytelling, coupled with the visceral action sequences, makes it a definitive war film.\n\nOverall, Black Hawk Down is an unflinching portrayal of the horrors of war, delivering a visceral experience that grips the audience from start to finish. It's a powerful and thought-provoking film that pays tribute to the soldiers who fought and lost their lives in this brutal battle.""]","['Lone Survivor', 'Hours The Secret Soldiers of Benghazi', 'Zero Dark Thirty']"
