movie,year,rating,genre,runtime_min,imdb,metascore,votes,director(s),stars,review,recommendations
What Is a Woman?,2022,Livre,['Documentary'],95.0,8.3,,39867,Justin Folk,"['Matt Walsh', 'Gert Comfrey', 'Marci Bowers', 'Don Sucher']","['Title: What Is a Woman? - Unraveling the Essence of Femininity\n\nRating: ★★★★☆\n\nIn the thought-provoking documentary ""What Is a Woman?"", director Jane Williams explores the complex and timely concept of femininity, challenging conventional notions and inviting viewers to consider the multifaceted nature of womanhood. With a combination of intimate interviews, historical analysis, and personal anecdotes, this film offers a refreshingly inclusive and educational perspective on the matter.\n\nWilliams skillfully weaves together the perspectives of various individuals, from scholars and activists to transgender women and non-binary individuals. Each interviewee shares their experiences, shedding light on the intersectionality of gender and identity. Their candid reflections provide invaluable insights into the challenges and triumphs faced by individuals in their journey to embrace themselves fully.\n\nWhat truly sets this documentary apart is its unwavering commitment to inclusivity. Being neither dismissive nor divisive, ""What Is a Woman?"" emphasizes the importance of understanding and respecting diverse lived experiences. By presenting a multitude of narratives, the film exposes the limitations of society\'s traditional view of femininity and encourages the viewer to rethink preconceived notions.\n\nThe film\'s cinematography beautifully complements the narrative, with evocative visuals and carefully selected archival footage. It seamlessly blends animated sequences and scholarly discussions to create a visually engaging experience that complements the depth of the subject matter.\n\nIf there\'s one critique, it would be the occasional lack of exploration in certain subtopics. Due to time constraints, some issues are only briefly touched upon, leaving the viewer craving further analysis. However, this limitation does not detract significantly from the overall impact of the film.\n\n""What Is a Woman?"" is an essential watch for anyone interested in gender studies or seeking a greater understanding of the complexities of femininity in the modern world. It challenges societal norms, promotes empathy, and ultimately encourages us all to reflect on and celebrate the diverse expressions of womanhood.']","['Paris is Burning', 'Disclosure', 'The Danish Girl']"
Searching for Sugar Man,2012,PG-13,"['Documentary', 'Biography', 'Music']",86.0,8.2,79.0,71168,Malik Bendjelloul,"['Rodriguez', ""Stephen 'Sugar' Segerman"", 'Dennis Coffey', 'Mike Theodore']","[""Searching for Sugar Man is a captivating and heartwarming documentary that tells the incredibly inspiring story of Sixto Rodriguez, a forgotten musician from the 1970s who becomes an unexpected icon in South Africa.\n\nDirected by Malik Bendjelloul, the film takes us on a fascinating journey of discovery as two South African fans, Stephen 'Sugar' Segerman and Craig Bartholomew Strydom, set out to unravel the mystery surrounding Rodriguez's disappearance after a promising but unsuccessful music career in the United States.\n\nWhat makes Searching for Sugar Man stand out is not just its investigative nature but also the emotional depth it explores. As the filmmakers uncover more about Rodriguez's life, the film explores themes of perseverance, the power of music, and the impact of art on society.\n\nThe documentary is expertly crafted, with Bendjelloul masterfully weaving together interviews, archive footage, and animated sequences. The film's pacing is flawless, keeping the audience engaged and emotionally invested throughout.\n\nBut what truly makes Searching for Sugar Man shine is its subject. Rodriguez is an enigmatic and deeply talented artist, and his music serves as the backbone of the film. His hauntingly beautiful lyrics and soulful melodies add a layer of magic that pervades the entire documentary.\n\nSearching for Sugar Man is a triumph on multiple levels. It not only sheds light on a remarkable and largely unknown artist but also celebrates the indomitable human spirit. It reminds us of the profound impact music can have and the ability of art to touch lives across continents and generations.""]","['Once', 'Anvil The Story of Anvil', 'Twenty Feet from Stardom']"
A Storm Foretold,2023,,"['Documentary', 'Biography', 'History']",90.0,7.7,,260,Christoffer Guldbrandsen,"['Christoffer Guldbrandsen', 'Roger Stone', 'Joe Biggs', 'Kristin Davis']","['Movie Review: A Storm Foretold\n\n""A Storm Foretold"" is a gripping and thought-provoking film that skillfully combines elements of mystery, romance, and drama to deliver a captivating storyline. Directed by the talented newcomer, Sarah Lewis, this film is a breath of fresh air in an industry often saturated with predictable plots.\n\nThe narrative revolves around Jane, a young woman haunted by vivid nightmares that seem to predict impending disasters. As she grapples with the weight of these premonitions, she meets Max, a charming stranger who becomes entangled in her life\'s twists and turns. Together, they embark on a thrilling journey filled with unexpected plot twists and intense emotional encounters.\n\nThe standout feature of ""A Storm Foretold"" is its impeccable cinematography. The visuals are stunning, complementing the atmospheric tone of the movie and enhancing the audience\'s immersion in the narrative. The stormy weather serves as a metaphor for the turmoil both within Jane\'s mind and in her relationships, effectively creating a palpable sense of tension throughout.\n\nThe performances in the film are stellar, particularly from the lead actors. Jane\'s character is portrayed with depth and vulnerability by an outstanding actress, bringing a sense of authenticity to the role. Max, played by a charismatic performer, adds a layer of mystery and charm that keeps the audience guessing about his true intentions.\n\nWhile the film successfully keeps viewers engaged with its suspenseful storyline, it occasionally leaves unanswered questions, which may leave some viewers longing for more closure. However, this open-endedness also adds to the film\'s enigmatic appeal, allowing for personal interpretations and discussions long after the credits roll.\n\nIn conclusion, ""A Storm Foretold"" is a captivating cinematic experience that keeps audiences on the edge of their seats with its intriguing blend of mystery and romance. With its beautiful cinematography, strong performances, and layered narrative, this film is a promising debut for director Sarah Lewis. It comes highly recommended for those seeking an engaging and thought-provoking movie experience.']","['The Others', 'The Sixth Sense', 'The Orphanage']"
Stop Making Sense,1984,PG,"['Documentary', 'Music']",88.0,8.6,89.0,16383,Jonathan Demme,"['David Byrne', 'Bernie Worrell', 'Alex Weir', 'Steven Scales']","['Title: Stop Making Sense - A Mesmerizing Musical Spectacle\n\nDirector Jonathan Demme\'s 1984 concert documentary, Stop Making Sense, is an electrifying and immersive experience that transcends the boundaries of traditional filmmaking. Capturing the essence of the Talking Heads\' iconic performances, this film is nothing short of a mesmerizing musical spectacle.\n\nFrom the opening shot, Demme expertly crafts a pulsating energy that grips the audience from start to finish. Utilizing a minimalist stage setup that progressively builds throughout the film, the director cleverly showcases the band\'s infectious charisma and raw talent. The camera work is dynamic, skillfully capturing the essence of each musician\'s movements and expressions, intensifying the connection between the viewer and the performers.\n\nStop Making Sense stands out not only for its unrivaled visuals but also for its musical brilliance. David Byrne\'s boundless energy and unapologetic charisma dominate the stage, elevated by the band\'s tight-knit and exhilarating performances. With hits like ""Psycho Killer,"" ""Burning Down the House,"" and ""Once in a Lifetime,"" every song becomes a soul-stirring experience that reverberates through the cinema screen.\n\nDemme\'s keen attention to detail and his ability to capture the essence of a live concert creates an unparalleled sense of authenticity. This documentary blurs the line between a cinematic performance and a communal musical gathering, enveloping the viewer into the surreal atmosphere with each beat and chorus.\n\nStop Making Sense is not just a concert film; it is an artful exploration of the transformative power of music. A must-see for Talking Heads enthusiasts and music lovers alike, this visually stunning and emotionally resonant documentary will leave you craving for more of its sheer brilliance.']","['The Last Waltz', 'Talking Heads Chronology', 'Gimme Shelter']"
Jackass Forever,2022,R,"['Documentary', 'Action', 'Comedy']",96.0,6.8,74.0,48836,Jeff Tremaine,"['Johnny Knoxville', 'Steve-O', 'Chris Pontius', 'Dave England']","[""Title: Jackass Forever - An Outrageously Hilarious and Unapologetically Wild Farewell\n\nRating: ★★★★☆ (4/5)\n\nJackass Forever marks the audacious return of Johnny Knoxville and his band of daredevil misfits in a raucous explosion of gut-busting comedy and jaw-dropping stunts. Directed by Jeff Tremaine, this fourth and possibly final installment of the franchise serves as a fitting farewell to the absurdity and camaraderie that has characterized the Jackass series.\n\nTrue to form, Jackass Forever pulls no punches in delivering its signature blend of outrageous pranks, bone-crushing stunts, and lighthearted mayhem. The fearless team dives headfirst into a series of ludicrous challenges, pushing the boundaries of their physical endurance and leaving viewers simultaneously cringing and roaring with laughter. From daring obstacle courses to painfully hilarious pranks, the film refuses to tone down its gleeful disregard for personal safety.\n\nHowever, beneath the surface of this adrenaline-fueled madness lies a poignant thread of nostalgia and reflection. Jackass Forever acknowledges the passage of time, recognizing that its daredevils are no longer young and invincible. The bittersweet realization that they can't continue this reckless lifestyle indefinitely infuses the film with a refreshing layer of depth, giving a nod to the endurance of friendship and the inevitability of change.\n\nWhile some may argue that the shock value of Jackass Forever is not for everyone, fans of the series will revel in its return to form. The stunts are as jaw-dropping and cringe-inducing as ever, and the camaraderie among the cast members is palpable. The final act, filled with heartfelt farewells and teary-eyed laughter, leaves a lasting impression that lingers even after the credits roll.\n\nIn conclusion, Jackass Forever is a rollercoaster ride of outrageous comedy and breathtaking stunts, delivering the nostalgic shock value that fans have come to love and expect. While bidding farewell to this chaotic chapter, the film never loses sight of its heart, offering a surprisingly poignant reflection on friendship and the passage of time. A must-watch for Jackass enthusiasts and those seeking an adrenaline rush, Jackass Forever is an uproarious farewell that perfectly captures the essence of the franchise.""]","['Bad Grandpa', 'Borat Cultural Learnings of America for Make Benefit Glorious Nation of Kazakhstan', 'Dirty Grandpa']"
Porn to Be Free,2016,Unrated,['Documentary'],78.0,6.1,,362,Carmine Amoroso,"['Lasse Braun', 'Riccardo Schicchi', 'Giampiero Mughini', 'Giuliana Gamba']","[""Porn to Be Free is a compelling and thought-provoking documentary that delves deep into the controversial world of pornography. Directed by Lisa Jackson, this film challenges societal taboos and takes a critical look at the multi-billion dollar industry that often hides behind closed doors.\n\nThe documentary tackles the subject matter with a careful balance of sensitivity and honesty. Through interviews with industry insiders, activists, and performers themselves, Jackson provides a diverse range of perspectives on the impact of pornography on both individuals and society as a whole. The film gives a voice to those who have experienced the negative effects of the industry, while also highlighting the arguments made by proponents of sexual liberation and freedom of expression.\n\nWhat sets Porn to Be Free apart from other documentaries on the topic is its unwavering commitment to being unbiased. The filmmaker presents different sides of the argument without passing judgment, allowing viewers to form their own opinions. The captivating storytelling and powerful visuals engage the audience from start to finish, making it difficult to look away.\n\nWhile some may find the subject matter uncomfortable or controversial, Porn to Be Free is an important exploration of a topic that is often brushed under the rug. It poses questions about the consequences of porn on relationships, mental health, and society's perception of sexuality. Ultimately, it encourages viewers to critically think about the impact and ethical considerations surrounding pornography.\n\nPorn to Be Free is a must-watch for anyone interested in delving deep into the complex and often misunderstood world of pornography. It's a thought-provoking and eye-opening documentary that provides a platform for meaningful discussions on a topic that affects us all.""]","['The Price of Pleasure Pornography Sexuality and Relationships', 'Hot Girls Wanted', 'After Porn Ends']"
All the Beauty and the Bloodshed,2022,Unrated,['Documentary'],122.0,7.5,90.0,6061,Laura Poitras,"['Nan Goldin', 'David Velasco', 'Megan Kapler', 'Marina Berio']","[""All the Beauty and the Bloodshed is a mesmerizing and haunting film that will captivate audiences from start to finish. Director Adam Conrad has crafted a visually stunning experience that not only immerses the viewer in its intense storyline but also explores the depths of the human psyche.\n\nThe film follows the journey of Sarah, a young woman navigating a post-apocalyptic world, as she encounters a series of brutal and harrowing events. The first thing that strikes you about All the Beauty and the Bloodshed is its breathtaking cinematography. Conrad employs a mixture of dark, desolate landscapes and vibrant, ethereal visuals that create an unsettling and otherworldly atmosphere.\n\nThe performances are equally impressive, with the lead actress delivering a raw and emotionally charged portrayal of Sarah's struggle for survival. The supporting cast also shines, adding depth and complexity to the narrative. The film's haunting score heightens the sense of unease, emphasizing the themes of beauty and destruction that permeate throughout.\n\nWhile All the Beauty and the Bloodshed is undeniably a dark and violent film, it is also a deeply thought-provoking one. It explores themes of humanity, redemption, and the lengths we are willing to go to protect those we love. The nonlinear storytelling adds an element of mystery and keeps the audience engaged, piecing together the fragments of Sarah's journey.\n\nAll the Beauty and the Bloodshed is not for the faint-hearted, but for those who appreciate artful filmmaking and thought-provoking narratives, it is an unforgettable experience. Conrad's direction, combined with impeccable performances and stunning visuals, make this film a must-see for fans of the genre.""]","['Blue Ruin', 'No Country for Old Men', 'Oldboy']"
Free Solo,2018,PG-13,"['Documentary', 'Adventure', 'Sport']",100.0,8.1,83.0,73746,"['Jimmy Chin', 'Elizabeth Chai Vasarhelyi']","['Alex Honnold', 'Tommy Caldwell', 'Jimmy Chin', 'Cheyne Lempe']","[""Free Solo is a breathtaking documentary that ventures into the world of free solo climbing. Directed by Elizabeth Chai Vasarhelyi and Jimmy Chin, this film chronicles the awe-inspiring journey of Alex Honnold as he attempts to climb the 3,000-foot wall of El Capitan in Yosemite National Park, without any ropes or safety equipment.\n\nFrom the very first frame, Free Solo captivates audiences with its stunning cinematography. The film beautifully captures the scale and majesty of El Capitan, immersing viewers in the steep cliffs and vertigo-inducing heights. The grandeur is juxtaposed with the intimate moments shared with Honnold, providing a glimpse into his motivations and personal life.\n\nWhat sets Free Solo apart is its exploration of the psychology behind Honnold's risky endeavor. The film delves into his meticulous preparation, physical training, and the mental strain of attempting something so dangerous. It is a testament to the filmmakers' skill that they can convey the tension and suspense without resorting to sensationalism.\n\nThe heart-stopping climax of the documentary, Honnold's final ascent of El Capitan, is a nail-biting sequence that leaves viewers on the edge of their seats. The sheer bravery and audacity of the act is both awe-inspiring and terrifying. As an audience, we are forced to confront our own fears and contemplate the limits of human potential.\n\nFree Solo is more than just a film about climbing; it is a profound exploration of the human spirit, ambition, and the pursuit of greatness. It is a cinematic achievement that will leave you with a sense of wonder, and a newfound appreciation for the remarkable individuals who dare to defy the boundaries of possibility.""]","['Meru', 'The Dawn Wall', 'Valley Uprising']"
Untold: Jake Paul the Problem Child,2023,TV-MA,"['Documentary', 'Sport']",70.0,6.0,,1583,Andrew Renzi,"['Jake Paul', 'Logan Paul', 'Greg Paul', 'Amer Abdallah']","['Movie Review: Untold: Jake Paul the Problem Child\n\nRating: 2.5/5\n\n""Untold: Jake Paul the Problem Child"" is a documentary film that attempts to delve into the controversial and polarizing life of internet sensation turned boxer, Jake Paul. Directed by Kevin Macdonald, the film provides a glimpse into Paul\'s rise to fame, his notorious stunts, and his foray into professional boxing.\n\nWhile the film promises to unravel the enigma surrounding Jake Paul, it falls short in many aspects. The narrative feels disjointed, lacking a clear structure, and fails to explore the depths of Paul\'s psyche. Instead, it focuses more on sensationalizing his outrageous behavior and controversies, leaving the audience yearning for a deeper analysis.\n\nThe documentary\'s saving grace lies in its interviews with those familiar with Paul\'s journey. We hear from boxing trainers, promoters, and fellow YouTubers who provide insight into his training and motivations. These interviews offer a balanced perspective on Paul\'s skill and dedication to his boxing career, which is worthy of appreciation.\n\nHowever, the film\'s editing choices and pacing can be jarring at times, making it difficult to fully immerse oneself in the story. Certain aspects feel rushed, while others linger too long, causing the film to lose its grip on its audience.\n\n""Untold: Jake Paul the Problem Child"" will undoubtedly attract Paul\'s legion of fans, eager to see behind-the-scenes moments of their idol. But for those hoping for a profound exploration of the mindset of a controversial figure, this documentary may leave them unsatisfied.\n\nIn conclusion, while ""Untold: Jake Paul the Problem Child"" offers some intriguing moments and valuable insights from those close to the subject, it fails to elevate itself beyond superficiality and lacks the depth needed to truly understand and analyze the enigmatic persona of Jake Paul.']","['Fighting with My Family', 'Warrior', 'Million Dollar Baby']"
The Last Waltz,1978,PG,"['Documentary', 'Biography', 'Music']",117.0,8.1,88.0,19110,Martin Scorsese,"['Robbie Robertson', 'Muddy Waters', 'Neil Young', 'Van Morrison']","[""Title: The Last Waltz - A Majestic Farewell to an Iconic Band\n\nRating: ★★★★☆\n\nThe Last Waltz, directed by Martin Scorsese, is a mesmerizing documentary that captures the final concert of The Band, a legendary group that defined the sound and spirit of an era. With its impeccable cinematography and an incredible lineup of guest performers, this film is a must-watch for music lovers and fans of the band alike.\n\nScorsese's direction brilliantly balances between capturing the electrifying energy on stage and intimately delving into the lives of the band members. The camera work is arresting, seamlessly shifting between wide shots of the concert and intimate close-ups that effortlessly capture the raw emotions of the musicians.\n\nWhat makes The Last Waltz truly exceptional is the star-studded guest list, featuring iconic performers such as Bob Dylan, Neil Young, Joni Mitchell, and Eric Clapton. Each guest shines in their respective performances, adding a unique flavor to the concert experience. The chemistry between The Band and their guests is palpable, resulting in goosebumps-inducing collaborations that are nothing short of magical.\n\nThe documentary also offers insightful interviews with the band members, providing a deep understanding of their journey, struggles, and the reasons behind the decision to bid farewell. These introspective moments give the film a poignant layer, making it more than just a concert captured on screen.\n\nWhile The Last Waltz undoubtedly celebrates The Band's legacy, it also pays homage to the enduring power of music and the sheer joy of live performances. The concert sequences are beautifully edited, showcasing the band's extraordinary musicianship and ability to transport audiences into their world.\n\nOverall, The Last Waltz is an evocative tribute to The Band, expertly crafted by Scorsese. It captures the heart and soul of their music and leaves you longing for more long after the final note fades away.""]","['Gimme Shelter', 'Stop Making Sense', 'Buena Vista Social Club']"
Faces of Death,1978,Not Rated,"['Documentary', 'Horror']",105.0,4.2,,7700,John Alan Schwartz,"['Michael Carr', 'Samuel Berkowitz', 'Mary Ellen Brighton', 'Thomas Noguchi']","[""Movie Review: Faces of Death\n\nFaces of Death, directed by John Alan Schwartz, is a controversial and deeply disturbing documentary that pushes the boundaries of the genre. As a film critic, it is a challenging task to assess and evaluate a film like this, as it defies conventional standards of entertainment and storytelling.\n\nThe film claims to showcase real footage of death and various gruesome accidents, presenting a voyeuristic journey into the darkest corners of human experience. Controversy aside, Faces of Death does provoke a strong emotional reaction, albeit one of shock, disgust, and morbid fascination.\n\nFrom a technical standpoint, the production quality of the documentary is rough and unpolished, which adds to the unsettling tone. The use of handheld cameras and grainy footage gives a sense of rawness, further blurring the lines between reality and fiction. However, the lack of context and narrative structure makes it difficult to form a coherent understanding of what is being shown.\n\nFaces of Death has garnered infamy for its graphic content, with scenes that showcase extreme violence, animal cruelty, and even alleged human executions. These shocking images test the limits of the viewer's tolerance and raise ethical concerns regarding the exploitation of real suffering.\n\nUltimately, Faces of Death is a polarizing film that defies conventional critique. While it may appeal to those with a morbid curiosity, it is important to approach it with caution and consideration for its ethical implications. As a film critic, it is impossible to recommend this documentary to a general audience, as it offers little in terms of artistic merit and leaves a lasting impact that might be too disturbing for most viewers.""]","['Cannibal Holocaust', 'A Serbian Film', 'Salò or the  Days of Sodom']"
