movie,year,rating,genre,runtime_min,imdb,metascore,votes,director(s),stars,review,recommendations
The Deepest Breath,2023,PG,"['Documentary', 'Adventure']",108.0,7.8,69.0,9383,Laura McGann,"['David Attenborough', 'Leigh Baker', 'Mahmoud Barracuda', 'Ilaria Bonin']","[""The Deepest Breath is a heartwarming and poignant coming-of-age film that beautifully captures the complexities of adolescence and the power of friendship. Directed by a talented newcomer, it is a breath of fresh air amidst the multitude of generic teen dramas.\n\nThe story revolves around 12-year-old Freya, brilliantly portrayed by a promising young actress. Freya's journey towards self-discovery is sensitively explored as she navigates her way through the turbulent waters of adolescence. With her unyielding desire to uncover the truth about her absent father, she finds solace in the serenity of her favorite activity: diving into the depths of the ocean.\n\nThe film's strong suit lies in its relatable and multi-dimensional characters, each with their own struggles and aspirations. Freya's complicated relationship with her mother, played with nuanced authenticity, adds emotional depth to the narrative. The genuine chemistry between Freya and her quirky new friend, who shares her passion for diving, is heartwarming to witness.\n\nSpectacular underwater cinematography immerses the audience into Freya's world, magnifying the themes of exploration and introspection. The director masterfully uses visual symbolism and metaphors to convey Freya's emotional journey, diving as a metaphor for diving into her own emotional depths.\n\nDespite its predictable plot at times, The Deepest Breath succeeds in delivering a heartfelt and relatable story that resonates with audiences of all ages. It reminds us of the importance of embracing our individuality and facing our fears head-on. This hidden gem is sure to leave you in awe of its beautiful storytelling and leave you with a longing for your own dive into the unknown depths of life.""]","['The Florida Project', 'Moonlight', 'Beasts of the Southern Wild']"
BS High,2023,,['Documentary'],95.0,7.5,65.0,353,"['Travon Free', 'Martin Desmond Roe']",,"[""Movie Review: BS High\n\nRating: ★★☆☆☆ (2/5)\n\nBS High, directed by John Smith, is a coming-of-age comedy that fails to deliver on its potential. Set in a high school, the film follows a group of misfit students as they navigate the challenges of adolescence, friendships, and academic pressure. While the premise holds promise, the execution falls flat, leaving the audience underwhelmed.\n\nThe film suffers from an inconsistent tone, oscillating between slapstick humor and sentimental moments without finding a balance. The comedic moments, though occasionally chuckle-worthy, often rely on tired high school clichés and lack originality. The script fails to explore the underlying issues faced by teenagers in a meaningful way, opting for superficial gags instead.\n\nThe performances are also a mixed bag. While some actors show glimpses of potential, the majority struggle to bring depth to their characters. The lack of chemistry among the cast hinders the believability of their relationships, making it difficult for viewers to fully invest in their journeys.\n\nThe pacing is another downfall of BS High. The storytelling feels disjointed, with unnecessary subplots and meandering scenes that detract from the main narrative. As a result, the film feels overlong and loses the audience's engagement over time.\n\nDespite these shortcomings, BS High does have a few redeeming qualities. Visually, the movie is vibrant and captures the chaotic energy of high school life. Moreover, the soundtrack, featuring popular hits from the era, injects a nostalgic charm into certain scenes.\n\nIn conclusion, BS High is an uninspired comedy that fails to rise above its predictable plot and lackluster characters. While it may provide a few laughs, it ultimately falls short of being a memorable high school film.""]","['Mean Girls', 'Superbad', 'Booksmart']"
A Life Too Short: The Isabella Nardoni Case,2023,,"['Documentary', 'Crime']",104.0,6.1,,585,"['Micael Langer', 'Cláudio Manoel']","['Hebe Camargo', 'Márcio Campos', 'Marcos Carneiro', 'Ilana Casoy']","['A Life Too Short: The Isabella Nardoni Case"" is a gripping docudrama that explores the tragic story of Isabella Nardoni, a six-year-old Brazilian girl whose life was cut short in a brutal murder case that shocked the nation. Directed by Ana Beatriz Nogueira, this film delves deep into the harrowing events surrounding Isabella\'s death and the subsequent trial that unfolded.\n\nNogueira\'s direction successfully captures the raw emotions and complexity of this real-life case. Through a combination of interviews, news footage, and expert analysis, the film meticulously pieces together the timeline of events, allowing viewers to gain a comprehensive understanding of the tragedy. The pacing is skillfully managed, keeping the audience engaged and invested in the story throughout.\n\nWhat sets ""A Life Too Short"" apart is its balanced approach. It does not shy away from examining both sides of the Isabella Nardoni case, offering viewers an objective perspective. The inclusion of interviews with family members, lawyers, and investigators provides valuable insights into the investigation process and the impact the case had on the community.\n\nThe performances in the reenactments are commendable, with the actors effectively capturing the emotional turmoil and suspense surrounding the murder investigation. The cinematography brings an eerie atmosphere to the film, amplifying the sense of unease and tension.\n\nWhile ""A Life Too Short"" is undeniably a heartbreaking and at times distressing documentary, it serves as an important reminder of the consequences of domestic violence and the need for justice. It is a thought-provoking film that sheds light on a tragic episode in Brazilian history.']","['The Girl with the Dragon Tattoo', 'Capturing the Friedmans', 'The Invisible War']"
Take Care of Maya,2023,TV-14,['Documentary'],103.0,7.8,64.0,6250,Henry Roosevelt,,"[""Take Care of Maya is a heartwarming and captivating film that explores the depths of love, sacrifice, and the power of human connection. Directed by Ananya Roy, this emotional drama takes the audience on a poignant journey through the life of Maya, a young girl battling a life-threatening illness.\n\nThe film adeptly portrays the strength and resilience of Maya, beautifully brought to life by a stellar performance from the talented young actress, portraying her pain and struggles with a remarkable authenticity and vulnerability. It is impossible not to empathize with her character as she fights against her condition, and weaves an intricate web of relationships with those around her.\n\nAnanya Roy skillfully crafts a narrative that is both poignant and relatable, presenting a realistic portrayal of the complexity of family dynamics, and the sacrifices made for the ones we love. The film's cinematography is stunning, capturing the bittersweet moments with a delicate intimacy that adds to the emotional impact of the story.\n\nThe supporting cast delivers outstanding performances, particularly Maya's parents, played by seasoned actors who bring depth and nuance to their roles. Their love for their daughter is palpable, and the audience is left inspired by their unwavering devotion.\n\nWhile Take Care of Maya is undeniably emotional, it is also a celebration of life, reminding us to cherish every moment and the connections we make along the way. It is a true testament to the power of cinema to provoke reflection and compassion.""]","['Amour', 'Still Alice', 'The Diving Bell and the Butterfly']"
Untold: Hall of Shame,2023,TV-MA,"['Documentary', 'Crime', 'Sport']",78.0,6.4,,706,Bryan Storkel,"['John Ashcroft', 'Joe Biden', 'Matt Biondi', 'Barry Bonds']","[""Untold: Hall of Shame is a captivating documentary that delves deep into the controversies surrounding some of the most infamous sporting events in recent history. Directed by Chapman Way, the film offers a gripping exploration of the dark underbelly of sports, where scandal and corruption have tarnished the integrity of beloved games.\n\nOne of the film's greatest strengths is its ability to convey a sense of frustration and disbelief, as it uncovers the shocking truths behind these scandals. Through a combination of archival footage, interviews, and meticulous research, Untold: Hall of Shame presents a compelling and thought-provoking narrative that keeps audiences engaged from start to finish.\n\nWhat sets this documentary apart is its focus on the personal stories behind the scandals. By humanizing the individuals involved, the film transcends mere exposé, providing nuanced perspectives and shedding light on the complexities of these controversial events. The filmmakers succeed in capturing the emotional toll and lasting impact on both the victims and the perpetrators.\n\nVisually, the documentary is stunning, with expertly crafted cinematography that enhances the storytelling. The use of slow-motion shots and intense close-ups heightens the tension and creates a palpable sense of unease, effectively conveying the weight of these scandals.\n\nWhile Untold: Hall of Shame doesn't shy away from confronting uncomfortable truths, it maintains a balanced approach, allowing viewers to form their own opinions. The result is a thought-provoking and compelling documentary that challenges our perceptions of sports and leaves us questioning the ethical implications of our obsession with victory.\n\nOverall, Untold: Hall of Shame is a must-watch for sports enthusiasts and documentary aficionados alike. It's a powerful and eye-opening exploration of the dark side of sports, reminding us that behind the glitz and glory, there is often a troubling reality that needs to be acknowledged and addressed.""]","['Icarus', 'The Armstrong Lie', 'The King of Kong A Fistful of Quarters']"
Untold: Johnny Football,2023,TV-MA,"['Documentary', 'Sport']",70.0,6.9,,2231,Ryan Duffy,"['Eric Bolling', 'Blake Bortles', 'Erik Burkhardt', 'Barbara Bush']","['Untold: Johnny Football Review\n\n""Untold: Johnny Football"" is a captivating documentary that takes us on a rollercoaster journey of fame, stardom, and downfall. Directed by Jake Hubbard, this film offers a raw and intimate portrayal of the rise and fall of American football quarterback Johnny Manziel.\n\nThrough a combination of expert storytelling and candid interviews, the documentary explores the meteoric rise of Manziel, from his college years as a fearless and electrifying player to becoming the first freshman to win the prestigious Heisman Trophy. The film delves into the pressures and expectations placed upon Manziel as he enters the NFL, where the weight of fame and his personal struggles collide.\n\nWhat sets ""Untold: Johnny Football"" apart is its ability to humanize Manziel, presenting a multidimensional perspective of his life. The film doesn\'t shy away from Manziel\'s mistakes, including his battles with addiction, personal demons, and the high-profile controversies that ultimately cut short his professional football career.\n\nHubbard skillfully captures the emotional toll that fame can inflict on an individual, emphasizing the delicate balance between talent, success, and personal struggles faced by athletes in the spotlight. The documentary also shines a necessary light on the darker side of professional sports and the immense pressure that follows young athletes.\n\n""Untold: Johnny Football"" provokes introspection as it prompts viewers to examine the consequences of our society\'s obsession with celebrity culture. It serves as a cautionary tale, reminding us that fame and fortune do not guarantee happiness and fulfillment.\n\nIn conclusion, ""Untold: Johnny Football"" is a thought-provoking and emotionally charged documentary that captures the highs and lows of one man\'s journey through the world of professional football. It\'s a must-watch for sports enthusiasts, but also appeals to a wider audience as a compelling examination of the dangers of fame and the human spirit\'s resilience.']","['The Blind Side', 'Friday Night Lights', 'Remember the Titans']"
Dear Zachary: A Letter to a Son About His Father,2008,Not Rated,"['Documentary', 'Biography', 'Crime']",95.0,8.5,82.0,39097,Kurt Kuenne,"['Kurt Kuenne', 'Andrew Bagby', 'David Bagby', 'Kathleen Bagby']","[""Dear Zachary: A Letter to a Son About His Father is an emotionally charged documentary that grips you from start to finish. Directed by Kurt Kuenne, this heart-wrenching film tells the tragic story of Andrew Bagby, who was murdered by his ex-girlfriend shortly after he and his girlfriend broke up.\n\nWhat makes this documentary so compelling is its intimate approach. Kuenne turns the camera into a personal letter to Zachary, Andrew's infant son, recounting the life of his father through interviews with friends, family, and home videos. The film serves as a testimony to a father Zachary will never know.\n\nThe raw emotions captured throughout the documentary are truly gut-wrenching. Kuenne successfully tugs at the heartstrings, evoking a rollercoaster of emotions from the audience. From moments of laughter through anecdotes of Andrew's joyous personality to moments of tearful devastation when the tragic events unfold, the impact of this documentary is profound.\n\nFurthermore, the storytelling is skillfully executed, revealing shocking twists and turns that keep you engaged until the very end. Kuenne effectively crafts a narrative that uncovers not only a murder mystery but also the flawed justice system that fails to protect innocent lives.\n\nHowever, be prepared to have tissues handy, as Dear Zachary is an emotionally challenging film to watch. It poses difficult questions about love, loss, and the darkest sides of human nature. Yet, it also reminds us of the resilience of the human spirit and the power of love and friendship in the face of unimaginable tragedy.\n\nIn conclusion, Dear Zachary: A Letter to a Son About His Father is a heartbreaking yet powerful documentary that reminds us of the fragility of life. It deserves to be seen, not only for its incredible storytelling, but also for its ability to touch the deepest corners of our hearts.""]","['The Thin Blue Line', 'Capturing the Friedmans', 'The Act of Killing']"
To End All War: Oppenheimer & the Atomic Bomb,2023,,['Documentary'],87.0,7.4,,1585,Christopher Cassel,"['J. Robert Oppenheimer', 'Kai Bird', 'Ellen Bradbury', 'Alan B. Carr']","[""To End All War: Oppenheimer & the Atomic Bomb offers a thought-provoking exploration of the complex and controversial figure at the heart of the creation of the atomic bomb – J. Robert Oppenheimer. Directed by a talented filmmaker, the documentary delves into the life and career of Oppenheimer, shedding light on the intense ethical dilemmas he faced.\n\nThe narrative structure of the film strikes a perfect balance between biographical elements and the broader historical context. Through archival footage, interviews, and meticulous research, the documentary seamlessly weaves together Oppenheimer's personal journey with the larger story of the Manhattan Project. This approach ensures that viewers gain a comprehensive understanding of the scientific, political, and moral dimensions surrounding the atomic bomb's development.\n\nWhat sets this documentary apart is its ability to present Oppenheimer as a multi-dimensional character. It dives into his conflicted psyche, his role as a leader, and his attempts to reconcile his scientific brilliance with the devastating consequences of his creation. The film is not afraid to address the controversy surrounding Oppenheimer's loyalty, resulting in a nuanced depiction that neither glorifies nor vilifies him.\n\nTo End All War: Oppenheimer & the Atomic Bomb is a compelling and thought-provoking exploration of one of humanity's most pivotal moments. It challenges its audience to grapple with profound questions about scientific progress, responsibility, and the potential for destruction. This expertly crafted documentary is sure to leave a lasting impression.""]","['Hiroshima Mon Amour', 'Fat Man and Little Boy', 'Dark Circle']"
Billion Dollar Heist,2023,,['Documentary'],84.0,7.0,,261,"['Daniel Gordon', 'Brendan Donovan', 'Bryn Evans']","['Eric Chien', 'Misha Glenny', 'Krishna Das', 'Mikko Hyppönen']","['Movie Review: Billion Dollar Heist\n\nRating: ★★★☆☆\n\nIn the action-packed thriller ""Billion Dollar Heist,"" director John Anderson delivers an adrenaline-fueled ride that keeps audiences on the edge of their seats. While the film\'s premise and execution are undeniably engaging, it falls short in delivering a truly memorable experience.\n\nThe plot centers around a mastermind thief, played by the charismatic John D\'Amico, who assembles a team of skilled criminals to pull off the ultimate heist - stealing a billion dollars from a highly secure corporate vault. From the get-go, the film establishes a fast pace and maintains it throughout, with breath-taking action sequences and well-choreographed heists that showcase the characters\' unique skills.\n\nHowever, where ""Billion Dollar Heist"" falters is in its character development and narrative depth. Despite the talented cast, including Emily Thompson as D\'Amico\'s daring partner-in-crime, the characters remain one-dimensional and fail to truly engage on an emotional level. Their motivations and backstories are largely overlooked, leaving the audience craving a deeper connection.\n\nFurthermore, the plot, while entertaining, follows a formulaic structure that doesn\'t offer many surprises. The twists and turns are predictable, and the resolution feels rushed, leaving some loose ends unresolved.\n\nHowever, the film\'s visual effects and stunt work are undeniably impressive. The meticulously choreographed action sequences, coupled with stunning cinematography, elevate the movie\'s entertainment value and help distract from its narrative shortcomings.\n\nIn conclusion, ""Billion Dollar Heist"" is an entertaining film that delivers on its promise of high-octane action. While it falls short in terms of character development and a truly captivating storyline, its adrenaline-fueled ride is sure to captivate fans of the heist genre.']","['Oceans Eleven', 'Inside Man', 'The Italian Job']"
Still: A Michael J. Fox Movie,2023,R,"['Documentary', 'Biography']",95.0,8.1,78.0,11244,Davis Guggenheim,"['Tracy Pollan', 'Sam Fox', 'Aquinnah Fox', 'Schuyler Fox']","[""Still: A Michael J. Fox Movie is a heartfelt and inspiring film that showcases the incredible talent and resilience of one of Hollywood's most beloved actors. Directed by a newcomer, the film tells the story of Michael J. Fox as he navigates life with Parkinson's disease.\n\nWhat sets this movie apart is its honesty and authenticity. Fox, playing a fictionalized version of himself, delivers a raw and vulnerable performance that will strike a chord with audiences. His portrayal of the daily challenges and frustrations of living with Parkinson's is nothing short of remarkable, capturing the physical and emotional toll it takes on him.\n\nThe supporting cast is equally commendable, providing depth and humor to the story. The chemistry between Fox and his co-stars brings warmth and humanity to the screen, creating a genuinely touching and relatable experience.\n\nThe screenplay, though at times predictable, delves into the complexities of living with a chronic illness and tackles themes of acceptance, resilience, and finding joy in the face of adversity. The dialogue is poignant and often laced with humor, reminding us of Fox's comedic prowess.\n\nVisually, the film is stunning, with each frame carefully crafted to convey emotions and provide a glimpse into Fox's world. The cinematography captures both the beauty of everyday life and the struggles that lie beneath the surface, enhancing the narrative and immersing the audience in the story.\n\nStill: A Michael J. Fox Movie is an emotional rollercoaster that will leave you inspired and appreciative of the human spirit. It shines a light on Parkinson's disease, allowing Fox to share his personal journey with sincerity and grace. It is a testament to his talent and serves as a reminder of the indomitable spirit that resides within us all.""]","['Back to the Future', 'Teen Wolf', 'The Secret of My Success']"
Bama Rush,2023,TV-MA,['Documentary'],100.0,4.1,,1721,Rachel Fleit,"['Shelby Rose', 'Isabelle Eacrett', 'Makalya Miller', ""Gracie O'Connor""]","['Bama Rush"" is a light-hearted comedy that takes a humorous and affectionate look at the unique world of sororities and the chaotic rush process. Director Sarah Johnson manages to capture the spirit and energy of the college life while offering a fresh and entertaining angle on the Greek system.\n\nThe film follows the journey of our protagonist, Emma, brilliantly portrayed by Lily Rodriguez, as she navigates the whirlwind of rush week at the fictional University of Alabama. With charming wit and undeniable charisma, Rodriguez brings Emma to life, capturing both the excitement and the challenges of the rush process.\n\nThe script, penned by Johnson and Jessica Adams, strikes a perfect balance between laughter and heart, providing genuinely funny moments alongside insightful commentary on friendship, identity, and self-discovery. The supporting cast members, including Kim Thompson as Emma\'s best friend and Taylor Scott as a no-nonsense sorority president, deliver solid performances, contributing to the film\'s overall charm.\n\nVisually, ""Bama Rush"" is vibrant and colorful, effortlessly capturing the beauty of the campus and immersing viewers into the world of Greek life. The energetic pacing and catchy soundtrack add to the film\'s appeal, ensuring that audiences remain engaged throughout.\n\nWhile ""Bama Rush"" may not offer groundbreaking storytelling or push the boundaries of the genre, it undeniably serves its purpose as an endearing comedy that will leave you with a smile on your face. As a film critic, I recommend ""Bama Rush"" to anyone looking for a light-hearted and entertaining watch that offers a peek into the sometimes-wacky world of sororities.']","['Legally Blonde', 'The House Bunny', 'Mean Girls']"
Poisoned: The Dirty Truth About Your Food,2023,TV-14,['Documentary'],83.0,6.7,,1612,Stephanie Soechtig,,"[""Title: Poisoned: The Dirty Truth About Your Food – A Startling Revelation for a Health-conscious Society\n\nRating: ★★★★☆\n\nPoisoned: The Dirty Truth About Your Food is a powerful and eye-opening documentary that exposes the dark side of the food industry, leaving viewers shocked and enlightened about the hidden dangers lurking in everyday meals. Directed by a team of investigative journalists, this thought-provoking film provides a wake-up call that demands attention.\n\nThe film pulls no punches as it delves deep into the various aspects of food production, highlighting the deceptive practices, unsafe chemicals, and unethical actions of corporations that dominate the industry. It intertwines interviews with professionals and whistleblowers, as well as gripping visual evidence, effectively unveiling the toxic truth behind our dinner plates.\n\nWhat makes Poisoned compelling is its ability to connect the dots between the food we eat and the health consequences we often overlook. The film exposes the alarming levels of pesticide residues, the overuse of antibiotics leading to resistance, and the treacherous conditions in factory farming. It forces us to confront the consequences of our choices and the need for a more sustainable and ethical food system.\n\nAlthough the documentary primarily focuses on the darker side, it doesn't fail to offer hope and potential solutions. It advocates for government regulation and consumer awareness, urging individuals to become more conscious consumers and demanding changes from the industry.\n\nWhile the film may not present all sides of the argument, it remains an important and timely picture for those who value their health and the future of the food they consume. Poisoned: The Dirty Truth About Your Food is an urgent call for action, leaving a lasting impact on viewers' minds and potentially reshaping the way we think about what we eat.""]","['Food Inc', 'Fed Up', 'Supersize Me']"
