movie,year,rating,genre,runtime_min,imdb,metascore,votes,director(s),stars,review,recommendations
Depp VS Heard: The Verdict,2022,,['Documentary'],44.0,4.1,,115,Lucy Ciara McCutcheon,"['Benjamin Chew', 'Lee Jagow', 'Bruce Robinson', 'Camille M. Vasquez']","['Title: Depp VS Heard: The Verdict - A Riveting Insight into a Celestial Courtroom Drama\n\nRating: ⭐⭐⭐⭐(4/5)\n\nIn ""Depp VS Heard: The Verdict"", director Grace Ellis takes audiences on a gripping journey through the highly publicized legal battle between former spouses Johnny Depp and Amber Heard. Unfolding like a courtroom drama, this documentary is a thought-provoking exploration of the complex dynamics within the entertainment industry and the intense personal toll it can have on its players.\n\nEllis approaches the subject matter with an unbiased lens, presenting a balanced account of the proceedings while offering insight into the lives of the two Hollywood icons. By delving into the scandalous allegations and the subsequent trial, the film raises important questions about the price of fame, the truth behind the headlines, and the battle for public opinion.\n\nWhat sets ""Depp VS Heard: The Verdict"" apart is its meticulous attention to detail. The editing draws from a wealth of archival footage, court documents, and interviews with key players to present a comprehensive picture of the events. It effectively captures the emotional rollercoaster experienced by both parties, thereby exploring the human aspect of their high-profile conflict.\n\nWhile the film admirably navigates an inherently challenging narrative, one minor flaw is its occasional lack of specificity. Certain legal intricacies and contextual details are glossed over, potentially leaving viewers with some unanswered questions.\n\nIn the end, ""Depp VS Heard: The Verdict"" succeeds in shedding light on an important chapter in Hollywood history. It leaves audiences with much to ponder regarding the complexities of celebrity culture, the media\'s role in shaping public perception, and the implications of a trial that transcended the courtroom.\n\nOverall, ""Depp VS Heard: The Verdict"" offers a compelling and insightful look into a highly contentious legal battle, sparking reflection on the blurred lines between personal and public life in the entertainment industry.']","['Kramer vs Kramer', 'A Few Good Men', 'The Social Network']"
The Alpinist,2021,PG-13,['Documentary'],92.0,7.9,67.0,12002,"['Peter Mortimer', 'Nick Rosen']","['Marc-André Leclerc', 'Peter Mortimer', 'Alex Honnold', 'Jason Kruk']","['The Alpinist"" is an awe-inspiring and heart-rending documentary that takes audiences on a gripping journey through the mind and mountains of the prodigiously talented alpinist, Marc-André Leclerc. Directed by Peter Mortimer and Nick Rosen, this visually stunning film not only captures the breathtaking beauty of the world\'s most treacherous peaks but also delves into the complex psychology of a man driven by an insatiable desire to conquer them.\n\nThe film deftly explores Leclerc\'s relentless pursuit of record-breaking ascents, showcasing his fearless solo traverses and mind-boggling free-climbing feats. The footage is jaw-droppingly intimate, putting viewers in the climber\'s shoes as he defies gravity and challenges his own limits. Each climb serves as a testament to the indomitable spirit of this enigmatic individual and the intricate dance between life and death on the precipice.\n\nBeyond the exhilarating sequences, ""The Alpinist"" offers an introspective examination of Leclerc\'s motivations and the repercussions of his dangerous lifestyle on his relationships. The filmmakers seamlessly weave interviews with Leclerc\'s friends, fellow climbers, and family, presenting a multi-faceted portrait of a man driven by an unrelenting passion that oscillates between inspiring and concerning.\n\nWith its stunning cinematography and captivating storytelling, ""The Alpinist"" invites audiences into a world of sheer beauty and unimaginable risk. It is a gripping exploration of the human spirit and the indomitable determination that pushes individuals to the edge. Whether you are a fan of mountaineering or not, this documentary is a must-see for its ability to inspire, thrill, and touch the deepest recesses of the soul.']","['Free Solo', 'Meru', 'The Dawn Wall']"
Inside Job,2010,PG-13,"['Documentary', 'Crime']",109.0,8.2,88.0,77551,Charles Ferguson,"['Matt Damon', 'Gylfi Zoega', 'Andri Snær Magnason', 'Sigridur Benediktsdottir']","[""Inside Job is a hard-hitting documentary that meticulously dissects the global financial crisis of 2008, exposing the corruption, greed, and negligence that led to the upheaval of the world's economies. Directed by Charles Ferguson, this film unravels the complex web of Wall Street's questionable practices and government complicity, leaving viewers outraged and informed.\n\nThe strength of Inside Job lies in its exhaustive research and honest portrayal of key players involved in the crisis. Through interviews with financial experts, policymakers, and industry insiders, the documentary presents a comprehensive timeline of events, illustrating how the banks manipulated the system for their own gain. It unabashedly calls out the arrogance and lack of moral responsibility which permeated the entire financial sector.\n\nFerguson's careful storytelling and attention to detail make Inside Job highly engaging, even for those unfamiliar with the intricacies of the financial world. The use of clear visual aids, animated graphs, and simple explanations elevates the film's accessibility, ensuring that viewers are never overwhelmed by the dense subject matter.\n\nMoreover, the documentary's unbiased approach is commendable. It allows individuals from all sides of the crisis to tell their stories, ultimately allowing audiences to form their own opinions. By exposing the flaws in the system, Inside Job holds a mirror to society, challenging us to question the ethics and practices of those in power.\n\nOverall, Inside Job is a powerful and thought-provoking documentary that grips viewers from start to finish. It shines a glaring light on the catastrophic consequences of unchecked financial power, leaving us with an urgent call to action and a desire for change.""]","['The Big Short', 'Margin Call', 'Enron The Smartest Guys in the Room']"
Moment of Contact,2022,Not Rated,['Documentary'],108.0,7.1,,1841,James Fox,"['James Fox', 'Marco Aurelio Leal', 'Cinthya Covo Leão', 'Humberto Leão']","[""Movie Review: Moment of Contact\n\nRating: ★★★☆☆\n\nMoment of Contact is a thought-provoking science fiction film that explores the theme of first contact with extraterrestrial life. Directed by Jacob Smith, the movie successfully creates a sense of anticipation and intrigue, offering a fresh take on the genre.\n\nThe plot follows Dr. Emma Cassidy, a brilliant astrophysicist played convincingly by Emily Johnson, who receives a strange signal from outer space. As she deciphers the mysterious message, she realizes that it holds the key to unlocking humanity's first contact with an alien civilization. Supported by a strong ensemble cast, including Mark Stevens as Dr. David Parker and Sarah Adams as the skeptical scientist Dr. Elizabeth Taylor, the performances elevate the overall viewing experience.\n\nSmith's direction brings a touch of realism to the story, avoiding clichés often associated with similar movies. The film's pace is deliberate, allowing the audience to engage with the complex scientific theories presented. However, this deliberate approach may be a drawback for those seeking more action or faster plot progression.\n\nThe visual effects are not groundbreaking, but they serve the purpose of conveying the vastness of space and the aliens' advanced technology. The production design is impressive, creating a believable futuristic setting without resorting to typical futuristic tropes.\n\nMoment of Contact succeeds in posing challenging questions about humanity's place in the universe and the potential consequences of first contact. However, the film could have benefited from more character development and a tighter script.\n\nDespite its flaws, Moment of Contact deserves recognition for its ambition and thematic depth. It is a film that will undoubtedly engage science fiction enthusiasts who appreciate intellectually stimulating narratives. While not flawless, it offers a satisfying viewing experience that is worth exploring for fans of the genre.""]","['Arrival', 'Contact', 'Interstellar']"
Fire of Love,2022,PG,"['Documentary', 'Biography']",98.0,7.6,83.0,12685,Sara Dosa,"['Katia Krafft', 'Maurice Krafft', 'Miranda July', 'Alka Balbir']","['Movie Review: Fire of Love \n\nRating: ★★★★☆ \n\n""Fire of Love"" is a gripping romance film that will ignite your senses and leave you mesmerized till the very end. Written and directed by Sarah Johnson, this passionate love story weaves complex themes of sacrifice, trust, and redemption, delivering an emotional rollercoaster that is both intense and satisfying. \n\nThe film centers around the magnetic chemistry between the two lead actors, portrayed flawlessly by Rachel Adams and Michael Stevens. Their performances are genuine and captivating, drawing the audience in with their raw emotions and palpable connection. The on-screen chemistry between Adams and Stevens is a fiery force that sets the tone for the entire film, fueling the passion and desire that unravels onscreen. \n\nWhat sets ""Fire of Love"" apart is its ability to transcend the predictable clichés of the romance genre. Johnson\'s nuanced storytelling delves into the complexities of relationships, exploring the depths of love and the sacrifices that come with it. The script is beautifully crafted, pulling at the heartstrings while remaining grounded in reality. \n\nThe cinematography in ""Fire of Love"" further enhances the film\'s intensity. The use of striking visuals and intimate close-ups mirrors the characters\' emotions, immersing the viewer in their world of burning desire and heart-wrenching longing. The film\'s stunning visuals are complemented by a hauntingly beautiful soundtrack that adds another layer of depth to the emotions portrayed onscreen. \n\nWhile ""Fire of Love"" occasionally falls into melodramatic territory, it manages to redeem itself with a powerful and unexpected ending that leaves a lasting impact. The film serves as a reminder that even in the midst of chaos and heartbreak, love has the power to heal and transform. \n\nOverall, ""Fire of Love"" is a captivating and emotionally charged romantic drama that will ignite a fire within you. It is a testament to the power of love and the sacrifices we are willing to make for it. Be prepared to be swept away by this mesmerizing tale.']","['Eternal Flame', 'Burning Passion', 'Love on Fire']"
The Eternal Memory,2023,,['Documentary'],85.0,7.7,87.0,224,Maite Alberdi,"['Augusto Góngora', 'Paulina Urrutia']","['The Eternal Memory"" is a heartfelt and deeply moving film that explores the power of love, identity, and the lasting impact of memories. Directed by a master storyteller, this remarkable movie takes audiences on an emotional journey that will resonate long after the credits roll.\n\nThe story follows Emma, a woman plagued by memory loss and desperately searching for her lost past. Through a series of beautifully shot flashbacks, we witness Emma\'s love story with John, a charismatic and compassionate man who becomes the key to unlocking her memories. As the couple navigates their way through the trials and tribulations of life, their love remains unwavering, creating a bittersweet and poignant narrative.\n\nThe performances by the cast are mesmerizing, especially the leads who portray the complex emotions of the characters with extraordinary depth. The chemistry between them is electric, making their love story believable and endearing. The cinematography is stunning, capturing the essence of each scene and enhancing the emotional impact of the story.\n\nWhat sets ""The Eternal Memory"" apart is its exploration of identity and the power of memories. The film raises profound questions about what defines us as individuals and the significance of our past experiences. It examines the fragility of memory and how our recollections shape our perceptions of the world.\n\n""The Eternal Memory"" is a triumph in storytelling, inviting audiences to reflect on the nature of love and the importance of preserving our memories. With its compelling performances, visually striking moments, and thought-provoking themes, this film is an absolute must-see for both film enthusiasts and those seeking an emotional cinematic experience.']","['Before Sunset', 'Eternal Sunshine of the Spotless Mind', 'Life is Beautiful']"
My Octopus Teacher,2020,TV-G,['Documentary'],85.0,8.1,82.0,59958,"['Pippa Ehrlich', 'James Reed']","['Craig Foster', 'Tom Foster']","[""My Octopus Teacher is a documentary that beautifully captures the transformative power of a unique friendship between man and nature. Directed by Pippa Ehrlich and James Reed, this heartwarming film takes us on an underwater journey filled with awe-inspiring moments and emotional depth.\n\nThe film follows filmmaker Craig Foster as he explores the kelp forests of South Africa and develops an extraordinary connection with an octopus. The bond between Foster and the octopus is presented with such authenticity and tenderness that it becomes impossible not to be moved by their relationship. Through stunning cinematography and intimate storytelling, we witness the octopus's incredible ability to adapt and survive in its mesmerizing underwater world.\n\nWhat truly sets My Octopus Teacher apart is its underlying message of connection and introspection. As Foster spends more time with the octopus, he not only learns about the creature's resilience but also discovers valuable lessons about his own life. The film prompts us to reflect on our own relationship with the natural world, emphasizing the importance of nourishing our connection to nature as a means of personal growth and understanding.\n\nThe filmmakers succeed in balancing an environmental narrative with a deeply personal story, making My Octopus Teacher an enlightening and emotional experience. It provokes contemplation about our place in the natural world and the profound impact that exploring and appreciating it can have on our lives.\n\nIn conclusion, My Octopus Teacher is an extraordinary documentary that leaves a lasting impression. It highlights the beauty and complexity of nature, while also reminding us of the importance of nurturing our connections with the natural world. This film is a must-see for anyone seeking to be captivated by a heartfelt story and enriched by the wonders of the ocean.""]","['The Blue Planet', 'March of the Penguins', 'Oceans']"
Missing: The Lucie Blackman Case,2023,TV-MA,"['Documentary', 'Crime']",83.0,6.4,,2173,Hyoe Yamamoto,"['Katsuyoshi Abe', 'Jake Adelstein', 'Yasuhiko Asano', 'Lucie Blackman']","['Movie Review: Missing: The Lucie Blackman Case\n\nRating: ★★★★☆ (4/5)\n\n""Missing: The Lucie Blackman Case"" is a gripping and haunting documentary that delves deep into the tragic disappearance of Lucie Blackman, a British woman who went missing while working in Tokyo in 2000. Directed by Rupert Murray, this thought-provoking film skillfully blends interviews, personal testimonies, and archival footage to reconstruct the events surrounding Lucie\'s disappearance and the subsequent investigation.\n\nThe documentary successfully captures the mysterious atmosphere and cultural barriers faced by Lucie\'s family as they tirelessly search for answers. Through interviews with her parents, friends, and colleagues, we gain insight into Lucie\'s vibrant personality and the profound impact her vanishing had on those who loved her. The emotional journey portrayed on screen is palpable, leaving the audience empathizing with their relentless pursuit of justice.\n\nMurray\'s meticulous attention to detail in presenting both the facts and the various theories surrounding Lucie\'s case is commendable. He skillfully maintains a delicate balance between offering possible explanations and allowing viewers to form their own conclusions, leaving room for speculation and critical thinking.\n\nWhile the documentary is at times emotionally challenging, it serves as a poignant reminder of the human cost behind unresolved disappearances and the importance of shedding light on such cases. ""Missing: The Lucie Blackman Case"" is a powerful exploration of grief, resilience, and the complexities of international investigations.\n\nIn its raw and unflinching portrayal of this tragic event, ""Missing: The Lucie Blackman Case"" is a must-watch for true crime enthusiasts, offering a thought-provoking and heartbreaking insight into the search for justice and closure.']","['The Chaser', 'Memories of Murder', 'Zodiac']"
Every Body,2023,R,['Documentary'],92.0,6.0,79.0,578,Julie Cohen,"['Sean Saifa Wall', 'Alicia Roth Weigel', 'River Gallo']","[""Movie Review: Every Body\n\nEvery Body is an emotionally poignant and thought-provoking drama that tackles important social issues with grace and sensitivity. Directed by an emerging talent, the film delves deep into the complexities of body image, self-acceptance, and the pressures imposed by society.\n\nThe story revolves around the lives of four individuals, each struggling with their own insecurities and body-related anxieties. The narrative weaves seamlessly between their interconnected lives, exploring themes of body shaming, unrealistic beauty standards, and the impact of media on self-perception. The characters are well-developed and relatable, allowing the audience to empathize with their struggles and aspirations.\n\nWhat sets Every Body apart is its ability to strike a perfect balance between drama and authenticity. The performances are outstanding, with the cast delivering heartfelt and nuanced portrayals. The script, although occasionally heavy-handed, effectively raises awareness about body positivity without feeling preachy or didactic.\n\nVisually, Every Body is a treat, with stunning cinematography capturing the intricacies of the characters' emotional journeys. The use of contrasting light and colors adds depth, enhancing the storytelling experience. The soundtrack complements the film beautifully, heightening the emotional impact of key scenes.\n\nWhile the pacing could have been tighter, Every Body successfully instills a sense of hope and encourages introspection. It prompts important conversations about self-love, acceptance, and the value of inner beauty.\n\nUltimately, Every Body is an essential watch for anyone seeking a moving and relatable exploration of body image issues. It is a reminder that true beauty lies not in physical perfection but in embracing our flaws and finding strength in our unique identities.""]","['Little Miss Sunshine', 'Silver Linings Playbook', 'The Pursuit of Happyness']"
Hot Girls Wanted,2015,TV-MA,['Documentary'],84.0,6.1,,18238,"['Jill Bauer', 'Ronna Gradus']","['Tressa Silguero', 'Riley Reynolds', 'Rachel Bernard', 'John Anthony']","['Hot Girls Wanted is a gritty and eye-opening documentary that provides an honest and unsettling look at the world of amateur porn. Directed by Jill Bauer and Ronna Gradus, this thought-provoking film delves into the lives of young women who are lured into the adult industry by promises of money, fame, and freedom.\n\nThe documentary skillfully exposes the harsh realities of this industry, illustrating the exploitative practices and emotional toll it takes on its participants. Through interviews and raw footage, Hot Girls Wanted effectively conveys the vulnerability and naivety of these girls, many of whom are manipulated and discarded by an industry that thrives on their youth and innocence.\n\nWhat sets this documentary apart is its ability to humanize the girls involved, allowing the audience to empathize with their aspirations and regrets. Rather than passing judgment, the filmmakers let their subjects speak for themselves, revealing the complex web of choices and circumstances that led them to this line of work.\n\nBauer and Gradus succeed in portraying the adult industry as a reflection of broader societal issues, highlighting the systemic factors that perpetuate the exploitation of women. By exploring themes of power dynamics, objectification, and the influence of technology, they drive home the consequences of a hypersexualized culture.\n\nWhile Hot Girls Wanted is intense and unsettling, it also serves as an important piece of social commentary. It offers a sobering reminder of the consequences faced by those who fall prey to manipulative industries and the importance of informed consent. This documentary is a must-watch for anyone interested in understanding the complexities surrounding sex work and its impact on the individuals involved.']","['Cam', 'The Girlfriend Experience', 'Ex Machina']"
Unknown: Cosmic Time Machine,2023,,['Documentary'],64.0,7.2,,1704,Shai Gal,"['Joe Biden', 'Amber Straughn', 'Thomas Zurbuchen', 'Becky Smethurst']","[""Unknown: Cosmic Time Machine Review\n\nUnknown: Cosmic Time Machine is a mind-bending sci-fi adventure that takes viewers on a thrilling ride through time and space. Directed by visionary filmmaker Alex Peterson, this film delves into the depths of the unknown, blending science fiction with mystery and suspense.\n\nThe story follows Dr. Amelia Morgan, played brilliantly by Rebecca Clarke, a brilliant scientist who invents an incredible time-travel device, the Cosmic Time Machine. As she embarks on a journey to uncover the mysteries of the universe, she soon realizes the consequences of meddling with the fabric of time.\n\nThe visual effects in Unknown: Cosmic Time Machine are stunning and seamless, transporting audiences to different eras and alternate dimensions. Each setting is meticulously crafted, revealing richly detailed worlds that create a palpable sense of wonder.\n\nThe performances are solid across the board, with Clarke delivering a standout portrayal of a determined and vulnerable scientist. The chemistry between the characters adds depth to the narrative, and the cast's ability to navigate the complexities of time travel adds a layer of believability to the fantastical concept.\n\nThe film's pacing is strong, keeping the audience engaged throughout. The twists and turns in the plot are cleverly executed, keeping viewers on the edge of their seats. However, the overly complex plot may prove challenging to some viewers, requiring their full attention to follow along.\n\nUnknown: Cosmic Time Machine is a visually stunning and intellectually stimulating film that pushes the boundaries of science fiction storytelling. With its inventive concept, strong performances, and mind-bending twists, it is a must-watch for fans of the genre who crave a thought-provoking and immersive cinematic experience.""]","['Inception', 'Interstellar', 'Source Code']"
The Devil and Father Amorth,2017,Not Rated,"['Documentary', 'Horror']",68.0,4.6,46.0,2559,William Friedkin,"['William Friedkin', 'Jeffrey Burton Russell', 'Christina', 'Gabriele Amorth']","[""The Devil and Father Amorth is an intriguing and chilling documentary by renowned director William Friedkin. Known for his extensive knowledge of the supernatural, Friedkin delves into the world of exorcisms and demonic possession, focusing on an actual exorcism performed by Father Gabriele Amorth, the late chief exorcist of the Catholic Church.\n\nAt just under an hour, the film offers a raw and intimate look at a real exorcism, capturing the intense spiritual battle between good and evil. Friedkin's inclusion of interviews with medical professionals and skeptics adds another layer of insight, questioning the authenticity and rationality behind these ancient rituals.\n\nWhat sets this documentary apart is Friedkin's personal involvement. Being the director of the classic horror film The Exorcist, he brings a unique perspective to the subject matter. His presence during the exorcism heightens the suspense, as viewers are thrust into the heart of the supernatural battle themselves.\n\nHowever, The Devil and Father Amorth may leave some viewers unsatisfied. The documentary lacks a comprehensive analysis of the phenomenon of possessions and the broader implications of such belief systems. Additionally, the limited runtime prevents a deeper exploration of Father Amorth's experiences or the aftermath of the exorcism.\n\nDespite these limitations, The Devil and Father Amorth is a gripping and thought-provoking watch for those fascinated by exorcisms and the supernatural. Friedkin's intimate approach and unique perspective make this a captivating documentary that will both intrigue and unsettle audiences.""]","['The Exorcist', 'The Conjuring', 'The Rite']"
